{
  "schema_version": "1.0",
  "mode": "summary",
  "components": [{"name": "web", "evidence": [{"status": "상충됨", "reference": "README.md:1; config.yaml:1"}]}],
  "dependencies": [],
  "excluded_items": [],
  "missing_inputs": [{"key": "runtime.command", "blocking": true, "evidence": [{"status": "상충됨", "reference": "README.md:1; config.yaml:1"}]}],
  "evidence": [{"status": "상충됨", "reference": "README.md:1; config.yaml:1"}],
  "design_input_verdict": "추가 정보 필요"
}
