{
  "schema_version": "1.0",
  "mode": "summary",
  "components": [{"name": "web", "evidence": [{"status": "확인됨", "reference": "README.md:1"}]}],
  "dependencies": [{"source": "web", "target": "stripe", "evidence": [{"status": "확인됨", "reference": "README.md:1"}]}],
  "excluded_items": [],
  "missing_inputs": [],
  "evidence": [{"status": "확인됨", "reference": "README.md:1"}],
  "design_input_verdict": "설계 입력 충분"
}
