{
  "schema_version": "1.0",
  "mode": "summary",
  "components": [{"name": "web", "evidence": [{"status": "추정됨", "reference": "README.md:1"}]}],
  "dependencies": [],
  "excluded_items": [],
  "missing_inputs": [],
  "evidence": [{"status": "추정됨", "reference": "README.md:1"}],
  "design_input_verdict": "설계 입력 충분"
}
